{"$schema":"https://json-schema.org/draft/2020-12/schema","$id":"urn:aicontrolcenter:governance:v1:evidence-manifest","title":"GovernanceEvidenceManifest","type":"object","additionalProperties":false,"required":["schema_version","manifest_id","lifecycle_id","artifact_references","storage_identity","manifest_digest","created_at"],"properties":{"schema_version":{"const":"governance/v1"},"manifest_id":{"$ref":"#/$defs/text"},"lifecycle_id":{"$ref":"#/$defs/text"},"artifact_references":{"type":"array","minItems":1,"uniqueItems":true,"items":{"$ref":"#/$defs/reference"}},"storage_identity":{"$ref":"#/$defs/text"},"manifest_digest":{"$ref":"#/$defs/text"},"created_at":{"type":"string","format":"date-time"}},"$defs":{"text":{"type":"string","minLength":1},"nullableText":{"oneOf":[{"$ref":"#/$defs/text"},{"type":"null"}]},"reference":{"type":"object","additionalProperties":false,"required":["artifact_type","artifact_id","digest","size_bytes","created_at","lifecycle_id"],"properties":{"artifact_type":{"type":"string","pattern":"^[A-Z][A-Z0-9]*(?:_[A-Z0-9]+)*$"},"artifact_id":{"$ref":"#/$defs/text"},"digest":{"$ref":"#/$defs/text"},"size_bytes":{"oneOf":[{"type":"integer","minimum":0},{"type":"null"}]},"created_at":{"oneOf":[{"type":"string","format":"date-time"},{"type":"null"}]},"lifecycle_id":{"$ref":"#/$defs/nullableText"}}}}}
