{"schema_version":"governance/v1","manifest_id":"manifest-synthetic-001","lifecycle_id":"lifecycle-synthetic-001","artifact_references":[{"artifact_type":"AUTHORIZATION_RECEIPT","artifact_id":"authorization-synthetic-001","digest":"digest-authorization-synthetic-001","size_bytes":256,"created_at":"2026-08-10T00:02:00+00:00","lifecycle_id":"lifecycle-synthetic-001"}],"storage_identity":"storage-synthetic","manifest_digest":"digest-manifest-synthetic-001","created_at":"2026-08-10T00:07:00+00:00"}
